{
	"name": "Treemonster",
	"slot": 7,
	"init": [
		{
			"$type": "message",
			"$comment": "unmute osc",
			"address": "/param/fx/global/1/type",
			"value": 24
		}
	],
	"controls": [
		{
			"$type": "control-range",
			"label": "Pitch Thresh.",
			"address": "/param/fx/global/1/param1",
			"min": 0,
			"max": 1
		},
		{
			"$type": "control-range",
			"label": "Pitch Speed",
			"address": "/param/fx/global/1/param2",
			"min": 0,
			"max": 1
		},
		{
			"$type": "control-range",
			"label": "Pitch Low Cut",
			"address": "/param/fx/global/1/param3",
			"min": 0,
			"max": 1
		},
		{
			"$type": "control-range",
			"label": "Pitch High Cut",
			"address": "/param/fx/global/1/param4",
			"min": 0,
			"max": 1
		},
		{
			"$type": "control-range",
			"label": "Osc Pitch",
			"address": "/param/fx/global/1/param5",
			"min": 0,
			"max": 1
		},
		{
			"$type": "control-range",
			"label": "Osc Ring Mod",
			"address": "/param/fx/global/1/param6",
			"min": 0,
			"max": 1
		},
		{
			"$type": "control-range",
			"label": "Width",
			"address": "/param/fx/global/1/param7",
			"min": 0,
			"max": 1,
			"bipolar": 1
		},
		{
			"$type": "control-range",
			"label": "Mix",
			"address": "/param/fx/global/1/param8",
			"min": 0,
			"max": 1
		},
		{
			"$type": "control-spacer-address",
			"address": "/param/fx/global/1/param9"
		},
		{
			"$type": "control-spacer-address",
			"address": "/param/fx/global/1/param10"
		},
		{
			"$type": "control-spacer-address",
			"address": "/param/fx/global/1/param11"
		},
		{
			"$type": "control-spacer-address",
			"address": "/param/fx/global/1/param12"
		}
	]
}