{
	"name": "Delay",
	"slot": 7,
	"init": [
		{
			"$type": "message",
			"$comment": "unmute osc",
			"address": "/param/fx/global/1/type",
			"value": 1
		}
	],
	"controls": [
		{
			"$type": "control-range",
			"label": "Input Channel",
			"address": "/param/fx/global/1/param9",
			"min": 0,
			"max": 1,
			"bipolar": 1
		},
		{
			"$type": "control-range",
			"label": "Time L",
			"address": "/param/fx/global/1/param1",
			"min": 0,
			"max": 1
		},
		{
			"$type": "control-range",
			"label": "Time R",
			"address": "/param/fx/global/1/param2",
			"min": 0,
			"max": 1
		},
		{
			"$type": "control-range",
			"label": "Feedback",
			"address": "/param/fx/global/1/param3",
			"min": 0,
			"max": 1
		},
		{
			"$type": "control-range",
			"label": "Fdbk X-Feed",
			"address": "/param/fx/global/1/param4",
			"min": 0,
			"max": 1
		},
		{
			"$type": "control-range",
			"label": "Fdbk Low Cut",
			"address": "/param/fx/global/1/param5",
			"min": 0,
			"max": 1
		},
		{
			"$type": "control-range",
			"label": "Fdbk High Cut",
			"address": "/param/fx/global/1/param6",
			"min": 0,
			"max": 1
		},
		{
			"$type": "control-range",
			"label": "Mix",
			"address": "/param/fx/global/1/param11",
			"min": 0,
			"max": 1
		},
		{
			"$type": "control-range",
			"label": "Mod Rate",
			"address": "/param/fx/global/1/param7",
			"min": 0,
			"max": 1
		},
		{
			"$type": "control-range",
			"label": "Mod Depth",
			"address": "/param/fx/global/1/param8",
			"min": 0,
			"max": 1
		},
		{
			"$type": "control-spacer-address",
			"address": "/param/fx/global/1/param12"
		},
		{
			"$type": "control-spacer"
		},
		{
			"$type": "control-spacer"
		},
		{
			"$type": "control-spacer"
		},
		{
			"$type": "control-range",
			"label": "Width",
			"address": "/param/fx/global/1/param12",
			"min": 0,
			"max": 1,
			"bipolar": 1
		}
	]
}