{
	"name": "Bonsai",
	"slot": 6,
	"init": [
		{
			"$type": "message",
			"$comment": "unmute osc",
			"address": "/param/fx/a/2/type",
			"value": 28
		}
	],
	"controls": [
		{
			"$type": "control-range",
			"label": "Gain in",
			"address": "/param/fx/a/2/param1",
			"min": 0,
			"max": 1
		},
		{
			"$type": "control-range",
			"label": "Amount",
			"address": "/param/fx/a/2/param2",
			"min": 0,
			"max": 1
		},
		{
			"$type": "control-range",
			"label": "Distort",
			"address": "/param/fx/a/2/param3",
			"min": 0,
			"max": 1
		},
		{
			"$type": "control-menu",
			"items": [
				{
					"$type": "menu-item",
					"label": "Tilt Fil.",
					"onselect": {
						"$type": "message",
						"$comment": "1",
						"address": "/param/a/osc/1/param4",
						"value": 0
					}
				},
				{
					"$type": "menu-item",
					"label": "Pull Mids",
					"onselect": {
						"$type": "message",
						"$comment": "2",
						"address": "/param/a/osc/1/param4",
						"value": 1
					}
				}
			]
		},
		{
			"$type": "control-menu",
			"items": [
				{
					"$type": "menu-item",
					"label": "Gentle",
					"onselect": {
						"$type": "message",
						"$comment": "1",
						"address": "/param/a/osc/1/param4",
						"value": 0
					}
				},
				{
					"$type": "menu-item",
					"label": "Normal",
					"onselect": {
						"$type": "message",
						"$comment": "2",
						"address": "/param/a/osc/1/param4",
						"value": 1
					}
				},
				{
					"$type": "menu-item",
					"label": "Hard",
					"onselect": {
						"$type": "message",
						"$comment": "3",
						"address": "/param/a/osc/1/param10",
						"value": 2
					}
				},
				{
					"$type": "menu-item",
					"label": "Harsh",
					"onselect": {
						"$type": "message",
						"$comment": "4",
						"address": "/param/a/osc/1/param10",
						"value": 3
					}
				}
			]
		},
		{
			"$type": "control-range",
			"label": "Amount",
			"address": "/param/fx/a/2/param6",
			"min": 0,
			"max": 1
		},
		{
			"$type": "control-range",
			"label": "Noise Sens",
			"address": "/param/fx/a/2/param7",
			"min": 0,
			"max": 1
		},
		{
			"$type": "control-range",
			"label": "Noise Gain",
			"address": "/param/fx/a/2/param8",
			"min": 0,
			"max": 1
		},
		{
			"$type": "control-range",
			"label": "Dull",
			"address": "/param/fx/a/2/param9",
			"min": 0,
			"max": 1
		},
		{
			"$type": "control-range",
			"label": "Gain Out",
			"address": "/param/fx/a/2/param10",
			"min": 0,
			"max": 1
		},
		{
			"$type": "control-range",
			"label": "Mix",
			"address": "/param/fx/a/2/param11",
			"min": 0,
			"max": 1
		}
	]
}