{
	"name": "Reverb 2",
	"slot": 5,
	"init": [
		{
			"$type": "message",
			"$comment": "unmute osc",
			"address": "/param/fx/a/1/type",
			"value": 1
		}
	],
	"controls": [
		{
			"$type": "control-range",
			"label": "Pre-Delay",
			"address": "/param/fx/a/1/param1",
			"min": 0,
			"max": 1
		},
		{
			"$type": "control-switch",
			"label": "Band",
			"groups": [
				{
					"$type": "group",
					"label": "Reverb",
					"controls": [
						{
							"$type": "control-range",
							"label": "Room Size",
							"address": "/param/fx/a/1/param2",
							"min": 0,
							"max": 1
						},
						{
							"$type": "control-range",
							"label": "Decay Time",
							"address": "/param/fx/a/1/param3",
							"min": 0,
							"max": 1
						},
						{
							"$type": "control-range",
							"label": "Diffusion",
							"address": "/param/fx/a/1/param4",
							"min": 0,
							"max": 1
						},
						{
							"$type": "control-range",
							"label": "Buildup",
							"address": "/param/fx/a/1/param5",
							"min": 0,
							"max": 1
						},
						{
							"$type": "control-range",
							"label": "Modulation",
							"address": "/param/fx/a/1/param6",
							"min": 0,
							"max": 1
						}
					]
				},
				{
					"$type": "group",
					"label": "EQ",
					"controls": [
						{
							"$type": "control-range",
							"label": "Low Damp",
							"address": "/param/fx/a/1/param7",
							"min": 0,
							"max": 1
						},
						{
							"$type": "control-range",
							"label": "High Damp",
							"address": "/param/fx/a/1/param8",
							"min": 0,
							"max": 1
						}
					]
				}
			]
		},
		{
			"$type": "control-range",
			"label": "Mix",
			"address": "/param/fx/a/1/param10",
			"min": 0,
			"max": 1
		},
		{
			"$type": "control-range",
			"label": "Width",
			"address": "/param/fx/a/1/param9",
			"min": 0,
			"max": 1
		}
	]
}