{
    "name": "Macros",
    "slot": 14,
    "init": [],
    "controls": [
        {
            "$type": "control-range",
            "label": "Macro 1",
            "address": "/param/macro/1",
            "min": 0,
            "max": 1
        },
        {
            "$type": "control-range",
            "label": "Macro 2",
            "address": "/param/macro/2",
            "min": 0,
            "max": 1
        },
        {
            "$type": "control-range",
            "label": "Macro 3",
            "address": "/param/macro/3",
            "min": 0,
            "max": 1
        },
        {
            "$type": "control-range",
            "label": "Macro 4",
            "address": "/param/macro/4",
            "min": 0,
            "max": 1
        },
        {
            "$type": "control-range",
            "label": "Macro 5",
            "address": "/param/macro/5",
            "min": 0,
            "max": 1
        },
        {
            "$type": "control-range",
            "label": "Macro 6",
            "address": "/param/macro/6",
            "min": 0,
            "max": 1
        },
        {
            "$type": "control-range",
            "label": "Macro 7",
            "address": "/param/macro/7",
            "min": 0,
            "max": 1
        },
        {
            "$type": "control-range",
            "label": "Macro 8",
            "address": "/param/macro/8",
            "min": 0,
            "max": 1
        }
    ]
}