{
	"name": "Spring",
	"slot": 6,
	"init": [
		{
			"$type": "message",
			"$comment": "unmute osc",
			"address": "/param/fx/a/2/type",
			"value": 27
		}
	],
	"controls": [
		{
			"$type": "control-range",
			"label": "Size",
			"address": "/param/fx/a/2/param1",
			"min": 0,
			"max": 1
		},
		{
			"$type": "control-range",
			"label": "Decay",
			"address": "/param/fx/a/2/param2",
			"min": 0,
			"max": 1
		},
		{
			"$type": "control-range",
			"label": "Reflections",
			"address": "/param/fx/a/2/param3",
			"min": 0,
			"max": 1
		},
		{
			"$type": "control-range",
			"label": "HF Damp",
			"address": "/param/fx/a/2/param4",
			"min": 0,
			"max": 1
		},
		{
			"$type": "control-range",
			"label": "Spin",
			"address": "/param/fx/a/2/param5",
			"min": 0,
			"max": 1
		},
		{
			"$type": "control-range",
			"label": "Chaos",
			"address": "/param/fx/a/2/param6",
			"min": 0,
			"max": 1
		},
		{
			"$type": "control-range",
			"label": "Knock",
			"address": "/param/fx/a/2/param7",
			"min": 0,
			"max": 1
		},
		{
			"$type": "control-range",
			"label": "Mix",
			"address": "/param/fx/a/2/param8",
			"min": 0,
			"max": 1
		}
	]
}