{
	"name": "Combulator",
	"slot": 6,
	"init": [
		{
			"$type": "message",
			"$comment": "unmute osc",
			"address": "/param/fx/a/2/type",
			"value": 21
		}
	],
	"controls": [
		{
			"$type": "control-range",
			"label": "Center",
			"address": "/param/fx/a/2/param2",
			"min": 0,
			"max": 1
		},
		{
			"$type": "control-range",
			"label": "Offset 2",
			"address": "/param/fx/a/2/param3",
			"min": 0,
			"max": 1
		},
		{
			"$type": "control-range",
			"label": "Offset 3",
			"address": "/param/fx/a/2/param4",
			"min": 0,
			"max": 1
		},
		{
			"$type": "control-range",
			"label": "Feedback",
			"address": "/param/fx/a/2/param5",
			"min": 0,
			"max": 1,
			"bipolar": 1
		},
		{
			"$type": "control-range",
			"label": "Tone",
			"address": "/param/fx/a/2/param6",
			"min": 0,
			"max": 1
		},
		{
			"$type": "control-spacer"
		},
		{
			"$type": "control-spacer"
		},
		{
			"$type": "control-range",
			"label": "Mix",
			"address": "/param/fx/a/2/param12",
			"min": 0,
			"max": 1
		},
		{
			"$type": "control-range",
			"label": "Input Noise",
			"address": "/param/fx/a/2/param1",
			"min": 0,
			"max": 1
		},
		{
			"$type": "control-range",
			"label": "Pan 2",
			"address": "/param/fx/a/2/param10",
			"min": 0,
			"max": 1,
			"bipolar": 1
		},
		{
			"$type": "control-range",
			"label": "Pan 3",
			"address": "/param/fx/a/2/param11",
			"min": 0,
			"max": 1,
			"bipolar": 1
		},
		{
			"$type": "control-spacer"
		},
		{
			"$type": "control-spacer"
		},
		{
			"$type": "control-range",
			"label": "Comb 1 Mix",
			"address": "/param/fx/a/2/param7",
			"min": 0,
			"max": 1
		},
		{
			"$type": "control-range",
			"label": "Comb 2 Mix",
			"address": "/param/fx/a/2/param8",
			"min": 0,
			"max": 1
		},
		{
			"$type": "control-range",
			"label": "Comb 3 Mix",
			"address": "/param/fx/a/2/param9",
			"min": 0,
			"max": 1
		}
	]
}