{
	"name": "STRING",
	"slot": 0,
	"init": [
		{
			"$type": "message",
			"$comment": "unmute osc",
			"address": "/param/a/mixer/osc1/mute",
			"value": 0
		},
		{
			"$type": "message",
			"$comment": "set osc type",
			"address": "/param/a/osc/1/type",
			"value": 9
		}
	],
	"controls": [
		{
			"$type": "control-range",
			"label": "PITCH",
			"address": "/param/a/osc/1/pitch",
			"min": 0,
			"max": 1
		},
		{
			"$type": "control-menu",
			"items": [
				{
					"$type": "menu-item",
					"label": "Burst Noise",
					"onselect": {
						"$type": "message",
						"$comment": "Burst Noise",
						"address": "/param/a/osc/1/param1",
						"value": 0
					}
				},
				{
					"$type": "menu-item",
					"label": "Burst Pink",
					"onselect": {
						"$type": "message",
						"$comment": "Burst Pink",
						"address": "/param/a/osc/1/param1",
						"value": 1
					}
				},
				{
					"$type": "menu-item",
					"label": "Burst Sine",
					"onselect": {
						"$type": "message",
						"$comment": "Burst Sine",
						"address": "/param/a/osc/1/param1",
						"value": 2
					}
				},
				{
					"$type": "menu-item",
					"label": "Burst Trian",
					"onselect": {
						"$type": "message",
						"$comment": "Burst Trian",
						"address": "/param/a/osc/1/param1",
						"value": 3
					}
				},
				{
					"$type": "menu-item",
					"label": "Burst Ramp",
					"onselect": {
						"$type": "message",
						"$comment": "Burst Ramp",
						"address": "/param/a/osc/1/param1",
						"value": 4
					}
				},
				{
					"$type": "menu-item",
					"label": "Burst Sq",
					"onselect": {
						"$type": "message",
						"$comment": "Burst Sq",
						"address": "/param/a/osc/1/param1",
						"value": 5
					}
				},
				{
					"$type": "menu-item",
					"label": "Burst Sweep",
					"onselect": {
						"$type": "message",
						"$comment": "Burst Sweep",
						"address": "/param/a/osc/1/param1",
						"value": 6
					}
				},
				{
					"$type": "menu-item",
					"label": "Noise",
					"onselect": {
						"$type": "message",
						"$comment": "Noise",
						"address": "/param/a/osc/1/param1",
						"value": 7
					}
				},
				{
					"$type": "menu-item",
					"label": "Pink",
					"onselect": {
						"$type": "message",
						"$comment": "Pink",
						"address": "/param/a/osc/1/param1",
						"value": 8
					}
				},
				{
					"$type": "menu-item",
					"label": "Sine",
					"onselect": {
						"$type": "message",
						"$comment": "Sine",
						"address": "/param/a/osc/1/param1",
						"value": 9
					}
				},
				{
					"$type": "menu-item",
					"label": "Triangle",
					"onselect": {
						"$type": "message",
						"$comment": "Triangle",
						"address": "/param/a/osc/1/param1",
						"value": 10
					}
				},
				{
					"$type": "menu-item",
					"label": "Ramp",
					"onselect": {
						"$type": "message",
						"$comment": "Ramp",
						"address": "/param/a/osc/1/param1",
						"value": 11
					}
				},
				{
					"$type": "menu-item",
					"label": "Square",
					"onselect": {
						"$type": "message",
						"$comment": "Square",
						"address": "/param/a/osc/1/param1",
						"value": 12
					}
				},
				{
					"$type": "menu-item",
					"label": "Sweep",
					"onselect": {
						"$type": "message",
						"$comment": "Sweep",
						"address": "/param/a/osc/1/param1",
						"value": 13
					}
				},
				{
					"$type": "menu-item",
					"label": "Audio in",
					"onselect": {
						"$type": "message",
						"$comment": "Audio in",
						"address": "/param/a/osc/1/param1",
						"value": 14
					}
				}
			]
		},
		{
			"$type": "control-range",
			"label": "EXCT. LVL",
			"address": "/param/a/osc/1/param2",
			"min": 0,
			"max": 1
		},
		{
			"$type": "control-range",
			"label": "STR. 1 DECAY",
			"address": "/param/a/osc/1/param3",
			"min": 0,
			"max": 1
		},
		{
			"$type": "control-range",
			"label": "STR. 2 DECAY",
			"address": "/param/a/osc/1/param4",
			"min": 0,
			"max": 1
		},
		{
			"$type": "control-range",
			"label": "STR. 2 DETUNE",
			"address": "/param/a/osc/1/param5",
			"min": 0,
			"max": 1
		},
		{
			"$type": "control-range",
			"label": "STR. BAL.",
			"address": "/param/a/osc/1/param6",
			"min": 0,
			"max": 1
		},
		{
			"$type": "control-range",
			"label": "STIFFNESS",
			"address": "/param/a/osc/1/param7",
			"min": 0,
			"max": 1
		},
		{
			"$type": "control-spacer"
		},
		{
			"$type": "control-spacer"
		},
		{
			"$type": "control-range",
			"label": "KEYTRACK",
			"address": "/param/a/osc/1/keytrack",
			"min": 0,
			"max": 1
		},
		{
			"$type": "control-range",
			"label": "RETRIG",
			"address": "/param/a/osc/1/retrigger",
			"min": 0,
			"max": 1
		},
		{
			"$type": "control-range",
			"label": "FIL ROUTE",
			"address": "/param/a/mixer/osc1/route",
			"min": 0,
			"max": 2
		},
		{
			"$type": "control-spacer"
		},
		{
			"$type": "control-range",
			"label": "FM DEPTH",
			"address": "/param/a/osc/fm_depth",
			"min": 0,
			"max": 1
		},
		{
			"$type": "control-range",
			"label": "FM ROUTING",
			"address": "/param/a/osc/fm_routing",
			"min": 0,
			"max": 3
		}
	]
}