{
	"name": "No FX",
	"slot": 6,
	"init": [
		{
			"$type": "message",
			"$comment": "set fx type",
			"address": "/param/fx/a/2/type",
			"value": 0
		}
	],
	"controls": [
		{
			"$type": "control-spacer"
		},
		{
			"$type": "control-spacer"
		},
		{
			"$type": "control-spacer"
		},
		{
			"$type": "control-spacer"
		},
		{
			"$type": "control-spacer"
		},
		{
			"$type": "control-spacer"
		},
		{
			"$type": "control-spacer"
		},
		{
			"$type": "control-spacer"
		}
	]
}