{
	"name": "FM2",
	"slot": 1,
	"init": [
		{
			"$type": "message",
			"$comment": "unmute osc",
			"address": "/param/a/mixer/osc2/mute",
			"value": 0
		},
		{
			"$type": "message",
			"$comment": "set osc type",
			"address": "/param/a/osc/2/type",
			"value": 6
		}
	],
	"controls": [
		{
			"$type": "control-range",
			"label": "PITCH",
			"address": "/param/a/osc/2/pitch",
			"min": 0,
			"max": 1
		},
		{
			"$type": "control-range",
			"label": "M1 AMOUNT",
			"address": "/param/a/osc/2/param1",
			"min": 0,
			"max": 1
		},
		{
			"$type": "control-range",
			"label": "M1 RATIO",
			"address": "/param/a/osc/2/param2",
			"min": 0,
			"max": 32
		},
		{
			"$type": "control-range",
			"label": "M2 AMOUNT",
			"address": "/param/a/osc/2/param3",
			"min": 0,
			"max": 1
		},
		{
			"$type": "control-range",
			"label": "M2 RATIO",
			"address": "/param/a/osc/2/param4",
			"min": 0,
			"max": 32
		},
		{
			"$type": "control-range",
			"label": "M1/2 OFFSET",
			"address": "/param/a/osc/2/param5",
			"min": 0,
			"max": 1
		},
		{
			"$type": "control-range",
			"label": "M1/2 PHASE",
			"address": "/param/a/osc/2/param6",
			"min": 0,
			"max": 1
		},
		{
			"$type": "control-range",
			"label": "FEEDBACK",
			"address": "/param/a/osc/2/param7",
			"min": 0,
			"max": 1
		},
		{
			"$type": "control-spacer"
		},
		{
			"$type": "control-spacer"
		},
		{
			"$type": "control-range",
			"label": "KEYTRACK",
			"address": "/param/a/osc/2/keytrack",
			"min": 0,
			"max": 1
		},
		{
			"$type": "control-range",
			"label": "RETRIG",
			"address": "/param/a/osc/2/retrigger",
			"min": 0,
			"max": 1
		},
		{
			"$type": "control-range",
			"label": "FIL ROUTE",
			"address": "/param/a/mixer/osc2/route",
			"min": 0,
			"max": 2
		},
		{
			"$type": "control-spacer"
		},
		{
			"$type": "control-range",
			"label": "FM DEPTH",
			"address": "/param/a/osc/fm_depth",
			"min": 0,
			"max": 1
		},
		{
			"$type": "control-range",
			"label": "FM ROUTING",
			"address": "/param/a/osc/fm_routing",
			"min": 0,
			"max": 3
		}
	]
}