{
	"name": "EQ 11",
	"slot": 7,
	"init": [
		{
			"$type": "message",
			"$comment": "unmute osc",
			"address": "/param/fx/global/1/type",
			"value": 16
		}
	],
	"controls": [
		{
			"$type": "control-range",
			"label": "30hz",
			"address": "/param/fx/global/1/param1",
			"min": 0,
			"max": 1
		},
		{
			"$type": "control-range",
			"label": "120hz",
			"address": "/param/fx/global/1/param3",
			"min": 0,
			"max": 1
		},
		{
			"$type": "control-range",
			"label": "500hz",
			"address": "/param/fx/global/1/param5",
			"min": 0,
			"max": 1
		},
		{
			"$type": "control-range",
			"label": "2khz",
			"address": "/param/fx/global/1/param7",
			"min": 0,
			"max": 1
		},
		{
			"$type": "control-range",
			"label": "8khz",
			"address": "/param/fx/global/1/param9",
			"min": 0,
			"max": 1
		},
		{
			"$type": "control-range",
			"label": "16khz",
			"address": "/param/fx/global/1/param11",
			"min": 0,
			"max": 1
		},
		{
			"$type": "control-spacer"
		},
		{
			"$type": "control-spacer"
		},
		{
			"$type": "control-range",
			"label": "60hz",
			"address": "/param/fx/global/1/param2",
			"min": 0,
			"max": 1
		},
		{
			"$type": "control-range",
			"label": "250hz",
			"address": "/param/fx/global/1/param4",
			"min": 0,
			"max": 1
		},
		{
			"$type": "control-range",
			"label": "1khz",
			"address": "/param/fx/global/1/param6",
			"min": 0,
			"max": 1
		},
		{
			"$type": "control-range",
			"label": "4khz",
			"address": "/param/fx/global/1/param8",
			"min": 0,
			"max": 1
		},
		{
			"$type": "control-range",
			"label": "12khz",
			"address": "/param/fx/global/1/param10",
			"min": 0,
			"max": 1
		},
		{
			"$type": "control-spacer"
		},
		{
			"$type": "control-spacer"
		},
		{
			"$type": "control-range",
			"label": "Gain",
			"address": "/param/fx/global/1/param12",
			"min": 0,
			"max": 1
		}
	]
}