{
	"name": "Spring",
	"slot": 7,
	"init": [
		{
			"$type": "message",
			"$comment": "unmute osc",
			"address": "/param/fx/global/1/type",
			"value": 27
		}
	],
	"controls": [
		{
			"$type": "control-range",
			"label": "Size",
			"address": "/param/fx/global/1/param1",
			"min": 0,
			"max": 1
		},
		{
			"$type": "control-range",
			"label": "Decay",
			"address": "/param/fx/global/1/param2",
			"min": 0,
			"max": 1
		},
		{
			"$type": "control-range",
			"label": "Reflections",
			"address": "/param/fx/global/1/param3",
			"min": 0,
			"max": 1
		},
		{
			"$type": "control-range",
			"label": "HF Damp",
			"address": "/param/fx/global/1/param4",
			"min": 0,
			"max": 1
		},
		{
			"$type": "control-range",
			"label": "Spin",
			"address": "/param/fx/global/1/param5",
			"min": 0,
			"max": 1
		},
		{
			"$type": "control-range",
			"label": "Chaos",
			"address": "/param/fx/global/1/param6",
			"min": 0,
			"max": 1
		},
		{
			"$type": "control-menu",
			"items": [
				{
					"$type": "menu-item",
					"label": "Leave be",
					"onselect": {
						"$type": "message",
						"$comment": "1",
						"address": "/param/fx/global/1/param7",
						"value": 0
					}
				},
				{
					"$type": "menu-item",
					"label": "KNOCK",
					"onselect": {
						"$type": "message",
						"$comment": "2",
						"address": "/param/fx/global/1/param7",
						"value": 1
					}
				}
			]
		},
		{
			"$type": "control-range",
			"label": "Mix",
			"address": "/param/fx/global/1/param8",
			"min": 0,
			"max": 1
		},
		{
			"$type": "control-spacer-address",
			"address": "/param/fx/global/1/param9"
		},
		{
			"$type": "control-spacer-address",
			"address": "/param/fx/global/1/param10"
		},
		{
			"$type": "control-spacer-address",
			"address": "/param/fx/global/1/param11"
		},
		{
			"$type": "control-spacer-address",
			"address": "/param/fx/global/1/param12"
		}
	]
}