{
	"name": "Conditioner",
	"slot": 0,
	"init": [
		{
			"$type": "message",
			"$comment": "unmute osc",
			"address": "/param/fx/a/1/type",
			"value": 8
		}
	],
	"controls": [
		{
			"$type": "control-range",
			"label": "Bass",
			"address": "/param/fx/a/1/param1",
			"min": 0,
			"max": 1
		},
		{
			"$type": "control-range",
			"label": "Treble",
			"address": "/param/fx/a/1/param2",
			"min": 0,
			"max": 1
		},
		{
			"$type": "control-range",
			"label": "St. Width",
			"address": "/param/fx/a/1/param3",
			"min": 0,
			"max": 1
		},
		{
			"$type": "control-range",
			"label": "St. Balance",
			"address": "/param/fx/a/1/param4",
			"min": 0,
			"max": 1
		},
		{
			"$type": "control-range",
			"label": "Threshold",
			"address": "/param/fx/a/1/param5",
			"min": 0,
			"max": 1
		},
		{
			"$type": "control-range",
			"label": "Attack",
			"address": "/param/fx/a/1/param6",
			"min": 0,
			"max": 1
		},
		{
			"$type": "control-range",
			"label": "Release",
			"address": "/param/fx/a/1/param7",
			"min": 0,
			"max": 1
		},
		{
			"$type": "control-range",
			"label": "Gain",
			"address": "/param/fx/a/1/param8",
			"min": 0,
			"max": 1
		},
		{
			"$type": "control-range",
			"label": "Side Low Cut",
			"address": "/param/fx/a/1/param9",
			"min": 0,
			"max": 1
		}
	]
}