{
	"name": "Exciter",
	"slot": 7,
	"init": [
		{
			"$type": "message",
			"$comment": "unmute osc",
			"address": "/param/fx/global/1/type",
			"value": 19
		}
	],
	"controls": [
		{
			"$type": "control-range",
			"label": "Exciter Drive",
			"address": "/param/fx/global/1/param1",
			"min": 0,
			"max": 1
		},
		{
			"$type": "control-range",
			"label": "Exciter Tone",
			"address": "/param/fx/global/1/param2",
			"min": 0,
			"max": 1
		},
		{
			"$type": "control-range",
			"label": "Shape Attack",
			"address": "/param/fx/global/1/param3",
			"min": 0,
			"max": 1
		},
		{
			"$type": "control-range",
			"label": "Shape Release",
			"address": "/param/fx/global/1/param4",
			"min": 0,
			"max": 1
		},
		{
			"$type": "control-spacer"
		},
		{
			"$type": "control-spacer"
		},
		{
			"$type": "control-spacer"
		},
		{
			"$type": "control-range",
			"label": "Mix",
			"address": "/param/fx/global/1/param5",
			"min": 0,
			"max": 1
		}
	]
}