{
	"name": "Resonator",
	"slot": 5,
	"init": [
		{
			"$type": "message",
			"$comment": "unmute osc",
			"address": "/param/fx/a/1/type",
			"value": 17
		}
	],
	"controls": [
		{
			"$type": "control-switch",
			"label": "Band",
			"groups": [
				{
					"$type": "group",
					"label": "Band 1",
					"controls": [
						{
							"$type": "control-range",
							"label": "Freq 1",
							"address": "/param/fx/a/1/param1",
							"min": 0,
							"max": 1
						},
						{
							"$type": "control-range",
							"label": "Res 1",
							"address": "/param/fx/a/1/param2",
							"min": 0,
							"max": 1
						},
						{
							"$type": "control-range",
							"label": "Gain 1",
							"address": "/param/fx/a/1/param3",
							"min": 0,
							"max": 1
						}
					]
				},
				{
					"$type": "group",
					"label": "Band 2",
					"controls": [
						{
							"$type": "control-range",
							"label": "Freq 2",
							"address": "/param/fx/a/1/param4",
							"min": 0,
							"max": 1
						},
						{
							"$type": "control-range",
							"label": "Res 2",
							"address": "/param/fx/a/1/param5",
							"min": 0,
							"max": 1
						},
						{
							"$type": "control-range",
							"label": "Gain 2",
							"address": "/param/fx/a/1/param6",
							"min": 0,
							"max": 1
						}
					]
				},
				{
					"$type": "group",
					"label": "Band 3",
					"controls": [
						{
							"$type": "control-range",
							"label": "Freq 3",
							"address": "/param/fx/a/1/param7",
							"min": 0,
							"max": 1
						},
						{
							"$type": "control-range",
							"label": "Res 3",
							"address": "/param/fx/a/1/param8",
							"min": 0,
							"max": 1
						},
						{
							"$type": "control-range",
							"label": "Gain 3",
							"address": "/param/fx/a/1/param9",
							"min": 0,
							"max": 1
						}
					]
				}
			]
		},
		{
			"$type": "control-menu",
			"items": [
				{
					"$type": "menu-item",
					"label": "Lowpass",
					"onselect": {
						"$type": "message",
						"$comment": "1",
						"address": "/param/a/osc/1/param10",
						"value": 0
					}
				},
				{
					"$type": "menu-item",
					"label": "Bandpass",
					"onselect": {
						"$type": "message",
						"$comment": "2",
						"address": "/param/a/osc/1/param10",
						"value": 1
					}
				},
				{
					"$type": "menu-item",
					"label": "BP+Notch",
					"onselect": {
						"$type": "message",
						"$comment": "3",
						"address": "/param/a/osc/1/param10",
						"value": 2
					}
				},
				{
					"$type": "menu-item",
					"label": "Highpass",
					"onselect": {
						"$type": "message",
						"$comment": "4",
						"address": "/param/a/osc/1/param10",
						"value": 3
					}
				}
			]
		},
		{
			"$type": "control-range",
			"label": "Gain Out",
			"address": "/param/fx/a/1/param11",
			"min": 0,
			"max": 1
		},
		{
			"$type": "control-range",
			"label": "Mix",
			"address": "/param/fx/a/1/param12",
			"min": 0,
			"max": 1
		}
	]
}