{
	"name": "Freq. Shifter",
	"slot": 7,
	"init": [
		{
			"$type": "message",
			"$comment": "unmute osc",
			"address": "/param/fx/global/1/type",
			"value": 7
		},
		{
			"$type": "message",
			"$comment": "unmute osc",
			"address": "/param/fx/global/1/param1/extend+",
			"value": 7
		}
	],
	"controls": [
		{
			"$type": "control-range",
			"label": "Left Shift",
			"address": "/param/fx/global/1/param1",
			"min": 0,
			"max": 1
		},
		{
			"$type": "control-range",
			"label": "Right Shift",
			"address": "/param/fx/global/1/param2",
			"min": 0,
			"max": 1
		},
		{
			"$type": "control-range",
			"label": "Delay Time",
			"address": "/param/fx/global/1/param3",
			"min": 0,
			"max": 1
		},
		{
			"$type": "control-range",
			"label": "Delay Fdbk.",
			"address": "/param/fx/global/1/param4",
			"min": 0,
			"max": 1
		},
		{
			"$type": "control-spacer"
		},
		{
			"$type": "control-spacer"
		},
		{
			"$type": "control-spacer"
		},
		{
			"$type": "control-range",
			"label": "Mix",
			"address": "/param/fx/global/1/param5",
			"min": 0,
			"max": 1
		},
		{
			"$type": "control-spacer-address",
			"address": "/param/fx/global/1/param6"
		},
		{
			"$type": "control-spacer-address",
			"address": "/param/fx/global/1/param7"
		},
		{
			"$type": "control-spacer-address",
			"address": "/param/fx/global/1/param8"
		},
		{
			"$type": "control-spacer-address",
			"address": "/param/fx/global/1/param9"
		},
		{
			"$type": "control-spacer-address",
			"address": "/param/fx/global/1/param10"
		},
		{
			"$type": "control-spacer-address",
			"address": "/param/fx/global/1/param11"
		},
		{
			"$type": "control-spacer-address",
			"address": "/param/fx/global/1/param12"
		}
	]
}