{
	"name": "Phaser",
	"slot": 6,
	"init": [
		{
			"$type": "message",
			"$comment": "unmute osc",
			"address": "/param/fx/a/2/type",
			"value": 3
		}
	],
	"controls": [
		{
			"$type": "control-range",
			"label": "Stage Count",
			"address": "/param/fx/a/2/param9",
			"min": 0,
			"max": 16
		},
		{
			"$type": "control-range",
			"label": "Stage Spread",
			"address": "/param/fx/a/2/param10",
			"min": 0,
			"max": 1
		},
		{
			"$type": "control-range",
			"label": "Stage Center",
			"address": "/param/fx/a/2/param1",
			"min": 0,
			"max": 1,
			"bipolar": 1
		},
		{
			"$type": "control-range",
			"label": "Stage Sharp",
			"address": "/param/fx/a/2/param3",
			"min": 0,
			"max": 1,
			"bipolar": 1
		},
		{
			"$type": "control-range",
			"label": "Stage Fdbk",
			"address": "/param/fx/a/2/param2",
			"min": 0,
			"max": 1,
			"bipolar": 1
		},
		{
			"$type": "control-range",
			"label": "Tone",
			"address": "/param/fx/a/2/param12",
			"min": 0,
			"max": 1,
			"bipolar": 1
		},
		{
			"$type": "control-range",
			"label": "Width",
			"address": "/param/fx/a/2/param8",
			"min": 0,
			"max": 1,
			"bipolar": 1
		},
		{
			"$type": "control-range",
			"label": "Mix",
			"address": "/param/fx/a/2/param7",
			"min": 0,
			"max": 1,
			"bipolar": 1
		},
		{
			"$type": "control-menu",
			"items": [
				{
					"$type": "menu-item",
					"label": "Sine",
					"onselect": {
						"$type": "message",
						"$comment": "1",
						"address": "/param/fx/a/2/param11",
						"value": 0
					}
				},
				{
					"$type": "menu-item",
					"label": "Triangle",
					"onselect": {
						"$type": "message",
						"$comment": "2",
						"address": "/param/fx/a/2/param11",
						"value": 1
					}
				},
				{
					"$type": "menu-item",
					"label": "Sawtooth",
					"onselect": {
						"$type": "message",
						"$comment": "3",
						"address": "/param/fx/a/2/param11",
						"value": 2
					}
				},
				{
					"$type": "menu-item",
					"label": "Noise",
					"onselect": {
						"$type": "message",
						"$comment": "4",
						"address": "/param/fx/a/2/param11",
						"value": 3
					}
				},
				{
					"$type": "menu-item",
					"label": "S&H",
					"onselect": {
						"$type": "message",
						"$comment": "5",
						"address": "/param/fx/a/2/param11",
						"value": 4
					}
				},
				{
					"$type": "menu-item",
					"label": "Square",
					"onselect": {
						"$type": "message",
						"$comment": "6",
						"address": "/param/fx/a/2/param11",
						"value": 5
					}
				}
			]
		},
		{
			"$type": "control-range",
			"label": "Mod Rate",
			"address": "/param/fx/a/2/param4",
			"min": 0,
			"max": 1
		},
		{
			"$type": "control-range",
			"label": "Mod Depth",
			"address": "/param/fx/a/2/param5",
			"min": 0,
			"max": 1
		},
		{
			"$type": "control-range",
			"label": "Mod Stereo",
			"address": "/param/fx/a/2/param6",
			"min": 0,
			"max": 1
		}
	]
}