{
	"name": "CLASSIC 2",
	"slot": 1,
	"init": [
		{
			"$type": "message",
			"$comment": "unmute osc",
			"address": "/param/a/mixer/osc2/mute",
			"value": 0
		},
		{
			"$type": "message",
			"$comment": "set osc type",
			"address": "/param/a/osc/2/type",
			"value": 0
		}
	],
	"controls": [
		{
			"$type": "control-range",
			"label": "Pitch",
			"address": "/param/a/osc/2/pitch",
			"min": 0,
			"max": 1,
			"bipolar": 1
		},
		{
			"$type": "control-range",
			"label": "Shape",
			"address": "/param/a/osc/2/param1",
			"min": 0,
			"max": 1,
			"bipolar": 1
		},
		{
			"$type": "control-range",
			"label": "Width 1",
			"address": "/param/a/osc/2/param2",
			"min": 0,
			"max": 1
		},
		{
			"$type": "control-range",
			"label": "Width 2",
			"address": "/param/a/osc/2/param3",
			"min": 0,
			"max": 1
		},
		{
			"$type": "control-range",
			"label": "Sub Mix",
			"address": "/param/a/osc/2/param4",
			"min": 0,
			"max": 1
		},
		{
			"$type": "control-range",
			"label": "Osc Sync",
			"address": "/param/a/osc/2/param5",
			"min": 0,
			"max": 1
		},
		{
			"$type": "control-range",
			"label": "Unison Detune",
			"address": "/param/a/osc/2/param6",
			"min": 0,
			"max": 1
		},
		{
			"$type": "control-range",
			"label": "Unison Voices",
			"address": "/param/a/osc/2/param7",
			"min": 0,
			"max": 16
		},
		{
			"$type": "control-spacer"
		},
		{
			"$type": "control-spacer"
		},
		{
			"$type": "control-spacer"
		},
		{
			"$type": "control-range",
			"label": "Keytrack",
			"address": "/param/a/osc/2/keytrack",
			"min": 0,
			"max": 1
		},
		{
			"$type": "control-range",
			"label": "Retrig",
			"address": "/param/a/osc/2/retrigger",
			"min": 0,
			"max": 1
		},
		{
			"$type": "control-range",
			"label": "Filter Routing",
			"address": "/param/a/mixer/osc2/route",
			"min": 0,
			"max": 2
		},
		{
			"$type": "control-range",
			"label": "FM Depth",
			"address": "/param/a/osc/fm_depth",
			"min": 0,
			"max": 1
		},
		{
			"$type": "control-range",
			"label": "FM Routing",
			"address": "/param/a/osc/fm_routing",
			"min": 0,
			"max": 3
		}
	]
}